弗拉德三世(EXTRA),140,191cm,90kg,史实,罗马尼亚,ヴラド三世,Vlad III,WADA ARUKO,江川央生,Lancer,男性,秩序·善,人,B,A,E,A,D,C,王,"罗马尼亚历史上著名的英雄。
坚持瓦拉几亚的独立，
是甚至被誉为基督教世界之盾的高洁武人。
然而，德古拉这个名称却更为普及，是无辜的怪物。

为保护瓦拉几亚免受土耳其军的侵犯，
肃正了让国土荒废了的贵族们，
将敌对的2万土耳其士兵施以穿刺刑，
但由于坚持严惩主义，导致贵族们的背叛。
他最后是被部下的瓦拉几亚贵族们暗杀的。","身高／体重：191cm·90kg
出处：史实
地域：罗马尼亚
属性：秩序·善　　性别：男性
容貌与言行犹如狂战士，但其眼中尚残留着最后的理性。残留着相信真正的爱，并想要保护其碎片的骑士的感情。","『串刺城塞』
阶级：C　种类：对军宝具
有效范围：0～50　最大捕捉：三百人
Kazikli Bey
让四周地面出现无数长枪，处决敌人，
由魔枪释放的诅咒与铁锤的拷问魔城（Draculea）。
由于对象是敌对的所有敌兵，
所以是在一对多战斗时才能发挥真正价值的宝具。
基于这个由来，该宝具拥有随对方不义·堕落之罪
的提升，施加的痛苦也相应提升的特性。
肃正对象越是犯下『逃跑』、『不道德』、
『暴力』之罪，破坏力就越巨大。","弗拉德三世为保卫瓦拉几亚独立，不择手段，
被土耳其方视作魔鬼般厌恶。
时值1462年。
为了以1万兵力对抗15万土耳其大军，
弗拉德三世下达了焦土战术与游击战的指示。
不仅让民众逃进喀尔巴阡山脉，
还让整座首都化为空城，并迎击土耳其军。
当时首都特尔戈维什泰周边排列着的，
是超过2万名被穿刺了的土耳其士兵的身影。

屹立于特尔戈维什泰要塞周围的无数被穿刺的尸体。
这异样的光景与恶臭令以勇猛著称的土耳其士兵们
完全丧失了斗志。
据说连被誉为“征服者”的勇猛的穆罕默德二世
都留下了「我不害怕任何人，但恶魔另当别论」的话，
并带领军队撤退了。
当时穿刺的原野长3公里，宽1公里。
据说日后奥斯曼土耳其帝国在占领瓦拉几亚之后，
也由于这次心理阴影，同意了瓦拉几亚的自治权。","德古拉本是他自己报上的名号，
意味着「龙的儿子」。
他父亲·弗拉德二世是神圣罗马帝国龙骑士团的骑士，
也是龙公（Dracul）这个称呼的由来。
弗拉德公相信对主的爱，
想要履行贵族应纠正不正当行为的职责。
然而沉溺于特权阶级财富的领主们厌恶他的清贫，
拯救了基督教世界的武人就这样因阴谋而遭到了惩罚。","无辜的怪物：A
由于生前的所作所为给人带来的印象，
以至于扭曲了过去和存在方式的怪物之名，
令能力、样貌大为改观。
在如今世界里，『德古拉』依然是世界最有名的怪物
之一。也可以说是创作扭曲了现实的最好案例吧。
……然而，实际上确实无法断言这一切都是创作者
布莱姆·斯托克的傲慢所致。
弗拉德三世为了维护瓦拉几亚的独立，不择手段，
无论是土耳其方，还是本国的民众，
都将他视为恶魔，恐惧不已。
根据教廷收到的记录，据说他一生中穿刺的人的数量
已经达到了10万人。而可怕的是，这个数量并不包括
敌国的人。",?,地底的信仰,"吾之道路染满了鲜血。

弹劾了数百贵族，
杀害了数万敌兵。

向我袭来的残忍。
我所犯下的残忍，
令这身体化为凶器。

但依然无法停手。
因为深爱主、保护主的教诲
才是让人成为人的道路。

友人说过。
我的信仰，会让我陷入疯狂。
不。决不。
当愤怒令我即将变得疯狂之际，
只因主之光辉的存在，我现在才能控制住我自己。

……但这里太暗了。
铁之铠甲，桩之指尖就算能触碰都到他人，
也已感受不到任何热量。
靠着这光辉，期待丧失了的温暖，
触碰到吾之面颊的那一天能到来。",https://fgo.wiki/images/thumb/3/33/%E5%9C%B0%E5%BA%95%E7%9A%84%E4%BF%A1%E4%BB%B0.png/300px-%E5%9C%B0%E5%BA%95%E7%9A%84%E4%BF%A1%E4%BB%B0.png,地底的信仰.png,-,
贞德・Alter・Santa・Lily,141,141cm,39kg,史实,圣诞岛,ジャンヌ・ダルク・オルタ・サンタ・リリィ,Jeanne d'Arc Alter Santa Lily,武内崇,坂本真绫,Lancer,女性,混沌·善,人,C,D,A,B,A++,A+,阿尔托莉雅脸,"吉尔·德·雷向圣杯许愿，导致了贞德·Alter诞生，而贞德·Alter喝下了吉尔伽美什王那可疑的药，导致了贞德·Alter·Lily的诞生，由于她想成为圣诞老人，才成了贞德·Alter·Santa·Lily。

正可谓第二代Alter亲！

……差不多该有人挺身而出阻止这一切了。","身高／体重：141cm·39kg
出处：史实（史实……？）
地域：圣诞岛（自称）
属性：混沌·善　　　性别：女性
和变成大人的我是不一样的！　哎嘿！","不用说也知道贞德乃是悲剧的圣女，
但她活跃年数仅仅两年，非常短暂。
贞德·Alter是本不存在的贞德黑化后的模样，
而贞德·Alter·Lily则是这不存在的少女年幼的样子，
无论哪个时间轴都不存在像她这样的存在的记录。","性格严格来说更像原来的贞德。
也就是非常认真、死板、偶尔会胡来，万不得已的时候不惜使用非法手段，就算不是万不得已，也会采用更有效率的非法手段之类的。

和原本贞德不同之处在于，一旦陷入恐慌，
就会慌张得手足无措以至于哭泣，令周围陷入混乱。
她本人似乎觉得看到成年后的贞德·Alter
自暴自弃的样子会很丢人。

「至今似乎仍对自己成为从者的事感到不好意思，也不知道该如何应对御主，真是个让人没辙的人啦！」

这乃是贞德·Alter·Santa·Lily的意见。
不过本人其实也挺想对御主撒娇的，
但她也压根不知道该怎么撒娇。
从这点来看，真不愧是贞德·Alter成长前的样子。","圣者的礼物：C
通过成为圣诞老人获得的技能。
赠送礼物，滋润心灵。
尽管还不成熟，但万事都认真对待的态度
从圣诞老人的角度来说，也值得给予较高的评价，
以新手圣诞老人的等级来说，做得还算相当不错了。

自我变革：A
原本，从者应该以全盛期的样子被召唤，
但她属于例外，她作为「今后将会继续成长」
的存在被召唤了。
心向恶即成恶，心向善即成善。
她的未来或许不会那么光明，
可即便如此，只要渴望，就会被赐予圣者的灯火。","『优雅歌唱吧，为那圣诞』
阶级：A+　种类：对军宝具
有效范围：1～10　最大捕捉：10人
La Grace Fille Noel
与咆哮吧，吾之愤怒成对，
只有在贞德·Alter·Santa·Lily兴致高昂的时候
才会发动的圣歌宝具。
对坏孩子就要予以教训（伤害），
对好孩子就要给予赠礼（buff）。
如雪花般飘落堆积的礼物
似乎在等待圣诞节的孩子们之间大受好评什么的。

另外，其实并不需要唱什么歌。",?,通往大海之门,"只要打开这扇门，
另一侧似乎就是一片广阔无垠的大海。

季节为夏日，阳光璀璨的海边，白云与苍穹无限延展……
似乎能够随时随地前往那种地方。
……对，大概是以前读的科幻小说吧。
当然没能全部读完，只是大致翻阅了一下……
能够连接任何地方的门，
对于驻留迦勒底的她来说，
是一个多么美妙的幻想啊。

……嗯，那孩子很清楚这是谎言啊。

但里面蕴含着梦想吧？
打开迦勒底之门这扇门，总有一天，
会通往她所追求的海洋的梦想。
我觉得这是个美妙的梦想，也这么相信。
如果我不去相信可爱妹妹的梦想，
那谁该去相信呢！

所以御主，说好了。
等总有一天情况安定下来之后，大家一起去看海吧？
那孩子一定也会高兴的……呵呵。",https://fgo.wiki/images/thumb/8/86/%E9%80%9A%E5%BE%80%E5%A4%A7%E6%B5%B7%E4%B9%8B%E9%97%A8.png/300px-%E9%80%9A%E5%BE%80%E5%A4%A7%E6%B5%B7%E4%B9%8B%E9%97%A8.png,通往大海之门.png,-,
伊什塔尔,142,159cm,47kg,古代美索不达米亚神话,美索不达米亚,イシュタル,Ishtar,MORII SHIZUKI,植田佳奈,Archer,女性,秩序·善,天,B,B,B,EX,A,A++,神性、天地从者(拟似从者),"美索不达米亚神话中美、丰收与战斗的女神。
传说是最被诸神们溺爱，
不对，是最受诸神们宠爱的女神。
她的外形并不是伊什塔尔女神的，
而是附身在与其波长相近的人类身上的拟似从者状态。
嘴上虽说守护人类是女神的职责，
但实际却是会笑眯眯地表示
「好啦，来看看人类究竟能活下去，
　还是会灭亡呢？」
这种意义的守护。
正可谓金星的（红色）恶魔。","身高／体重：159cm·47kg
出处：古代美索不达米亚神话
地域：美索不达米亚
属性：秩序·善　　　性别：女性
「原本的我应该更有魅力才对，
　但这躯体也不赖呢。」","苏美尔神名乃是伊南娜，
从名字角度来说，这个更古老。
伊什塔尔是阿卡德神名。
乃金星女神，
是司掌给人类带来繁荣的丰收的女神，
也是司掌战斗与破坏的女神，
还将可怕的神兽『天之公牛』送去乌鲁克市，
总之是个会给人添麻烦的女神。

以多情著称，据说无论对象是人类还是诸神，
只要是中意的对象，就会全力献殷勤。
另一方面，一旦对方不顺着自己的心意，
就会表现出恶魔般的残忍。
据说她之所以将神兽放到地上，
也是因为乌鲁克之王吉尔伽美什没有回应自己的诱惑。","『山脉震撼明星之薪』
阶级：A++　种类：对山宝具
An Gal Ta Kigal She。
在苏美尔神话中，伊什塔尔做过的
最具「破坏性」，最「残忍」的行为——
就是凭一句“只是看不顺眼而已”，
就蹂躏了诸神之王都敬畏的灵峰艾比夫山，
让整座山死绝这个传说化为的宝具。
美索不达米亚神话曰，伊什塔尔闯入艾比夫山，
每走一步就提升其神威，最后甚至一把抓住山脉之巅，
用枪刺入地脉的心脏部分，令艾比夫山脉彻底崩溃。

根据这个传说，在使用宝具时，她会先瞬移到金星，
使用管理者的权限，将金星的概念收入手中，
并作为概念行星塞入马安娜的弹仓中发射，
完成这种连神都会感到恐惧的行为。
别称为Jebel Hamrin Breaker。","魔力放出（宝石）：A+
将过剩的魔力附加在武器上来增加攻击力。
原本伊什塔尔自如的神气可以称得上万能，
但由于附体对象的影响，不知为何，
变得只能在宝石中积蓄魔力了。
虽然是强大的魔力放出技能，
但由于需要注入宝石并释放这个工程，
所以使用的时候稍微有些麻烦。

美之显现：EX→B
作为美之女神的可怕魅力。
能吸引他人的能力。虽然处于附体于他人的状态，
但也已经超越人的领域了。
原本是以强大诱惑为主体的复合技能
（充能吸收、诅咒、技能封印），
但由于被附体之人的强烈要求，
因此去除了向对手施加的束缚效果，
实质只剩下领袖气质单体技能了。
（从原本的EX阶级降到了B阶级。）","以巨大的弓，也就是飞船『天舟马安娜』为主武装。
马安娜是驰骋于美索不达米亚世界的神之舟，
也是连接地球与金星的星间转移门（Gate），
但由于本人是拟似从者，所以传送功能基本被封印。
伊什塔尔也能运用枪，但这次贯彻了Archer职阶。
虽说是美索不达米亚的神，
但给人一种从金星攻打地球的侵略者的印象。
biubiu。",?,七头战锤希塔,"『畏惧吧，称颂吧。敬仰、崇拜吧。
　那位女神正是天之女主人，受人爱戴的美丽化身。
　其手中握着的乃是美丽的七头锤矛。
　正如其凶猛狠辣的外表，是只要握在手中，
　就能毫不留情地打倒敌人的锡杖。
　怎么会这样，那位女神居然出生时
　就握着如此残酷的凶器。这是有多夸张啊。

　啊啊，黎明射出光线的象征啊
　噢噢，金星女神，引导拂晓。

　据说女神不喜欢被人守护，总是率先立于战阵中，
　获得比任何人都丰厚的战果什么的。
　然而，她的温情不仅限于战斗。
　罕见的心血来潮会让女神铲除造成洪水的怪物，
　基于丰收的权能勤于治水，
　促使众多城市热闹非凡。

　具备各种问题，各种侧面，
　但最终还是会给人世带来幸福与欢乐。
　伊南娜女神万岁。

　话说回来，据称伊南娜女神
　拥有另一把与这同一等级的破坏兵器。』

「给我等一下，这是对我的赞美歌吧！？
　为何里面到处可见若隐若现的真心话啦！？」",https://fgo.wiki/images/thumb/1/17/%E4%B8%83%E5%A4%B4%E6%88%98%E9%94%A4%E5%B8%8C%E5%A1%94.png/300px-%E4%B8%83%E5%A4%B4%E6%88%98%E9%94%A4%E5%B8%8C%E5%A1%94.png,七头战锤希塔.png,-,
恩奇都,143,？,？,吉尔伽美什史诗,美索不达米亚,エルキドゥ,Enkidu,MORII SHIZUKI,小林优,Lancer,其他,中立·中庸,天,？,？,？,？,？,A++,天地从者,"安定的语调，温和的举止，
却具备了难以想象超强战斗能力的“拥有意识的宝具”。
曾被英雄王吉尔伽美什誉为最强之人，
连接天与地之锁。
既是由众神之手所造的人偶，
亦是自然与调和一体化的大地分身。

作为英雄王唯一的友人，曾与其经历许多冒险，获得
人之心之后，却最终以人偶之躯归于尘土的可悲兵器。","身高／体重：可变
出处：吉尔伽美什史诗
地域：美索不达米亚
属性：中立·中庸　　　性别：－
「若让我战斗，我就会战斗哦。
　因为我其实并不讨厌战斗。」","吉尔伽美什史诗中描述的最古老英雄之一。
由诸神创造而出的兵器。原本是诸神创造而出的
“能变形成任何东西的粘土工艺品”。
能根据状况随心所欲改变形态。
全身等同于诸神的武器。
只不过不具备人类那样的精神与感情，
起初与野兽几乎没什么差别。

据说在显现于地上之后，由于遇见了一位圣妓，
获得了诸多认知，
才终于选择了人类的形态（作为基本形态）。
这姿态是因为尊重那位圣妓，而模仿她的结果。","战斗力与英雄王吉尔伽美什全盛期几乎等同。
在史诗中描述的与吉尔伽美什的一战中，
他发挥出了与被誉为人类史最强英雄之一的他
不相上下的性能。

是孤傲的吉尔伽美什王首次选出的朋友，
他自身也将吉尔伽美什视为独一无二的朋友。
在乌鲁克市的战斗后，
成为了朋友的吉尔伽美什与恩奇都经历了众多冒险，
最终在与神兽古伽兰那的战斗后殒命。","内向、主动、强势。
平时犹如美丽的花朵般伫立，但一旦行动，
却会成为不等人、不留情、不自重的可怕活跃怪物。

人类也是地球上的生命，所以是“喜欢”的对象，
但人类会基于知性将自然与自己划分着考虑，
因此不是很愿意拥护。
动物、植物身上有与自己相近的感觉，
因此大多数行动都是为了保护它们。

不过由于原本就好奇心（求知欲）强烈，
所以恩奇都很喜欢与人类对话。
如果这个人具备讨人喜欢的性格（充满博爱精神，
全体主义者，但依然最优先自己）的话，
会由衷表示敬爱与敬佩，乐于作为朋友支持对方。","变容：A
根据情况，将能力值从一定综合值中
重新分配的特殊技能。是恩奇都最大的特征。
阶级越高，综合值越高。
有时将筋力变化为A，有时将耐久变化为A。
只是参数值变换极限是固定的，
因此无法将所有数值都变成A。
恩奇都拥有30数值，各参数消耗数值分别为
A7、B6、C5、D4、E3。

气息感知：A+
最高级的气息感知能力。
能通过大地，远距离探测气息。

完全之形：A
利用大地的魔力，复原原本的形态。
利用神代粘土制作而成的恩奇都的身体
只要还有大地提供魔力，就不会崩溃。
具备他人不可比拟的强大再生、复原能力。
但灵魂除外。","『世人啊，冀以锁系神明』
阶级：A++　种类：对肃正宝具
Enuma Elish
将恩奇都自己的身体变成一件神造兵器。
化为用庞大能量变换而成的楔子，
贯穿、固定对象。

恩奇都原本就是诸神为了让吉尔伽美什
『回到神的身边』而派遣的兵器。

为了神与人不分离而制作的『天之楔』，
那就是吉尔伽美什。
但由于这位吉尔伽美什反叛神明，
他则担负着束缚吉尔伽美什并将其带回天上的职责。

然而恩奇都却成了吉尔伽美什的朋友，
这“甚至能束缚天的锁”依照朋友的愿望，
选择了为人而用之路。",胡姆巴巴之花,"『为何她会佩戴那个冠呢？』

天之锁情不自禁地呢喃道。
曾经战斗过的怪物。
在战斗前曾是朋友的怪物。
拥有比地上任何人——甚至比天之锁——
还要锐利爪子的可怕怪物。
但其头上戴着花朵。
天之锁过去在杉木林中种植的淡色小花。
为了那位拥有少女之心的怪物，
不惜扭曲地之理创造的花园。

『正因为是一串简单的装饰，
　纯真无暇的心灵才会感到喜悦。』

立于天之锁身旁的男人这么说完，转身折返城市。
留下了赠与朋友的第二串花冠。",https://fgo.wiki/images/thumb/1/18/%E8%83%A1%E5%A7%86%E5%B7%B4%E5%B7%B4%E4%B9%8B%E8%8A%B1.png/300px-%E8%83%A1%E5%A7%86%E5%B7%B4%E5%B7%B4%E4%B9%8B%E8%8A%B1.png,胡姆巴巴之花.png,-,
魁札尔・科亚特尔,144,181cm,64kg,阿兹特克神话,中南美,ケツァル・コアトル,Quetzalcoatl,广江礼威,远藤绫,Rider,女性,秩序·善,天,B,B,B+,EX,A+,EX,神性、骑乘、天地从者、王,"中南美阿兹特克神话中的至高存在之一。
看上去自由奔放，实际却是善良而充满知性的女神。
厌恶活祭仪式，深爱人类。
生命与丰收之神、文化之神、风雨之神。
曾经有一段时期还有过司掌太阳的传说。

最高存在（通过分灵）的现界。
在如此异常事态中，魁札尔·科亚特尔表现出了
谁人都不知道的崭新的一面。
那就是作为深爱兴盛于现代墨西哥的自由斗争——
深爱墨西哥摔角的神。
……她并没有被人奉为摔角之神。
只是本人很喜欢摔角而已。","身高／体重：181cm·64kg
出处：阿兹特克神话
地域：中南美
属性：秩序·善　　性别：女性
通过将身为从者的形态赐予了分灵之一
从而现界。","名字的意思是「有羽之蛇」、「有翼之蛇」。
被人们奉为否定活祭仪式的善神。
与身为启明星化身的善神特拉威斯卡尔潘泰库特利神、
玛雅的库库尔坎被视为同一存在。
拥有诸多善良的传说，
但也具备凶猛战神的一面。

魁札尔·科亚特尔虽然身为善神引领人们走向繁荣，
但最后却因输给了特斯卡特利波卡神，
从阿兹特克失去了踪影。
留下了总有一天将会回归的预言。

阿兹特克的人们相信之后来访的西班牙征服者就是
「归来的魁札尔·科亚特尔与其军队」，
最终走向了毁灭。","本来是男性神。
在现界时获得了身为女性神的存在。
本人表示，或许是在长时间被视为
同一存在的金星的影响下，导致被
金星=美神维纳斯（阿佛洛狄忒）的印象牵连所致。

南美的神与其他神话体系有很大的不同，
他们南美的诸神会通过『转移到人类身上』的方式活动。
魁札尔·科亚特尔神也随地域不同，被确认有复数存在，
或许某个时代的魁札尔·科亚特尔会以女性体出现。","『炽焰，亦焚尽神灵』
阶级：A　种类：对人·对城宝具
Xiuhcoatl
传说过去魁札尔·科亚特尔离开阿兹特克的时候，
为了不将众多财宝拱手让给恶神特斯卡特利波卡，
将自己的宫殿燃烧殆尽的火焰的再临。
让周围被火焰所包围，短暂阻止对手解放宝具真名——

本应如此，但由于本人沉迷摔角，
这宝具便成了极为古怪的存在。
基本是让对手飞向天空，并头朝下摔落，
根据情况，甚至可能改为从1000米的高空
朝着对方使出飞踢的打击技之类的。
本人将其取名为Ultimo Tope Patada。","『持翼之神』
阶级：A　种类：对人·对军宝具
Quetzalcoatl
之所以拥有Rider职阶的原因宝具。
召唤赐予了自己名字的白垩纪翼龙——
羽蛇神翼龙，并进行骑乘。
其实是比栖息于白垩纪的羽蛇神翼龙更为大幅强化了的
幻兽～神兽级的幻想种。
羽蛇神翼龙以历史上最大的飞行动物而著称。

真名解放时，
虽说骑乘翼龙的魁札尔·科亚特尔本应能够
大规模操控风雨雷电……
但这效果在本作基本没被使用。","沉迷于墨西哥摔角（格斗）的起因很单纯，
因为在某个被召唤的时代目睹了墨西哥摔角，
由于冲击过于巨大，导致这种印象被
深深烙印在了本体……好像是这样。

「没错，肉体！
　厮杀时就该尽量避免使用武器吧～！
　商谈时也用摔角才是最合适的～！」

最喜欢的摔角选手是La Mistico。
作为风之神，以及金星之神，看到没有翅膀
却能自由飞翔的Luchador（女性被称为Luchadora），
禁不住感动到流泪，甚至从中感到了未来。
之后，凭借天生的律己心与好学，
转眼间就成了墨西哥摔角大师。

号称只要自己有心，无论面对怎样的神性或怪物，
都能用头部固定来解决，
但为了传播以跳跃技为主的墨西哥摔角，
暂时封印了作为摔角精髓的关节技。",太阳之石,"据说在中南美神话中，死亡虽然是成长与成熟的结局，
也是全新诞生的前兆。
这绝不是单指生物的存在方式。
也是指世界的存在方式。
世界总是在重复着破坏与创造。

阿兹特克的诸神在破坏了古老世界之后，
一定会创造下一个世界。
据说现在的世界也是在经历了这样的过程后
被创造出来的第五世界。

同时，为身为世界的中心或是世界本身的
生命的隆盛提供庇护的——正是太阳。
根据一种说法，
魁札尔·科亚特尔乃是第二世界的太阳，
也引导了第五太阳。

阿兹特克的民众目睹了太阳的世界。
目睹了破坏与创造，死亡与诞生。

过去曾在特诺奇提特兰的神殿中，
现代则被保管于墨西哥城中的
“太阳之石”上雕刻的太阳（世界）有五个。
这是过去与现在的全部。

第五太阳迟早也会消失。
届时，究竟会诞生第六个新世界，
还是……

「——那就取决于你们啦～！」",https://fgo.wiki/images/thumb/a/ab/%E5%A4%AA%E9%98%B3%E4%B9%8B%E7%9F%B3.png/300px-%E5%A4%AA%E9%98%B3%E4%B9%8B%E7%9F%B3.png,太阳之石.png,-,
