冯・霍恩海姆・帕拉塞尔苏斯,79,183cm,65kg,史实,欧洲,ヴァン・ホーエンハイム・パラケルスス,Paracelsus von Hohenheim,中原,三木真一郎,Caster,男性,混沌·善,人,D,E,C,A,B,A+,所爱之人,"传说中的医生、炼金术士。
作为16世纪文艺复兴时期的人物为人们所知。
留下了包括「四元素（五元素）的再发现」，
「三元质的再发现」在内的大量成就与书籍。
在人类史与魔术史中都留下其功名的稀有人物。","身高／体重：183cm·65kg
出处：史实
地域：欧洲
属性：混沌·善　　　性别：男性
操控五元素的强大魔术师（Average One）。","理性稳重。性格温和，不好斗。
表示人类的感情比任何事物都要贵重。
将现代的魔术师们视为继承了自己教导的，
弟子们的后裔，平等而慈爱地对待他们。
——只要世界允许其（爱）存在。","道具作成：EX
以强大魔力积蓄结晶“贤者之石”为首，
对应五属性元素的人工灵，
复数个拥有同步思考能力的人造人，等等——
具备EX阶级技能的他能制作各式各样的道具。","『元素使的魔剑』
阶级：A+、种类：对军宝具
Sword of Paracelsus。
Azoth剑的根源。帕拉塞尔苏斯的魔剑。
用超高密度的“贤者之石”构成的魔术礼装。","宝具原本的效果是增幅、辅助、强化魔术，
但通过刀身的魔力，可瞬间执行仪式魔术，
以五种元素为媒介，
可以做到短暂地拟似构成神代真乙太。
真乙太（伪）可怕的威力能粉碎周围。",?,元素精灵,"元素精灵（Elemental）。
嗯，对。
如果用话语来表现，应该会这么说吧。
这是指象征四大元素的超自然的存在。
然而当我提起这个的时候，会有些许不同。

凝聚了各属性力量的人工灵。
这才是我所使役的元素精灵。
虽为超越现实的存在，但却不是幻想种。
地、水、火、风、以及空（Ether）。
五大属性的元素块。

既可以当做储蓄魔力的池来使用，也可以应用在防御或是攻击方面。对我来说，嗯，是作为研究的素材以及仪式魔术的触媒来使用的。

来吧。还请各位好好看着。
构成世界的元素的光辉……
终将引领我们去往根源的神秘存在。",https://fgo.wiki/images/thumb/8/8b/%E5%85%83%E7%B4%A0%E7%B2%BE%E7%81%B5.png/300px-%E5%85%83%E7%B4%A0%E7%B2%BE%E7%81%B5.png,元素精灵.png,-,
查尔斯・巴贝奇,80,250cm,500kg以上,史实,欧洲,チャールズ・バベッジ,Charles Babbage,I-IV,稻田彻,Caster,男性,混沌·中庸,人,B++,B++,D++,A,E,A+,?,"十九世纪的数学家、科学家。
梦想给世界带来变革的蒸汽王。天才学者。
提出了「差分机」与「分析机」的设计概念，
也即基于蒸汽机关的世界首台计算机雏形。
现代称其为「计算机之父」。","身高／体重：250cm·500kg以上（两者都包括铠甲）
出处：史实
地域：欧洲
属性：混沌·中立　　性别：男性
性格严谨，但对天真无邪或是聪明的少女没有抵抗力。","——志未成，身先死。
差分机没能完成。
分析机没能完成。
消失在时代狭缝中的「未来的可能性」之梦，
他将之留给世界，抱憾而逝。","而如今，他现界于世。
将未来的可能性——异形的钢铁披于身上。
将梦中的未来——异形的世界藏在心中。
作为英灵现界的他，其存在本身，
就是其宝具——和固有结界几乎为同一存在。","机械铠甲：EX
始终身披蒸汽机关制的全身铠甲。
提升筋力与耐久力阶级的同时，
也因异形蒸汽机关的推进功能，
令三项能力值都追加了「++」的修正。","『绚烂的灰烬世界』
阶级：A++、种类：对军宝具
Dimension of Steam。
渴望与梦想升华了的固有结界，
他的心，就是身披的机械铠甲本身。",?,真·差分机,"十九世纪初叶。
刚从剑桥大学毕业的青年在计算天体运动时——
面对庞大的数字量，陷入了思考。

不止在天体方面。无论是政府研究部门还是在野的企业，几乎所有实验与业务在进行大量计算的时候，都需要数十个人来操作。如果能将这无数计算交由机械代替的话。

而他继续思考。
这能行。

用蒸汽机关为动力，进行复杂高度计算的机械。
其名为差分机（Difference engine）。

没错，在各种学问中都要运用到数学。
当这台机械完成之时，
人类就能在各种领域实现飞跃性的时间节约，
文明也一定能前进数个世纪吧。
这是谁都未能达成的梦想。
　◆

他的愿望只差一步，最终未能实现。
然而，人们这么评价。
他确实是伟大天才之一，是文明的奠基石——

说他才是计算机之父。",https://fgo.wiki/images/thumb/5/58/%E7%9C%9F%C2%B7%E5%B7%AE%E5%88%86%E6%9C%BA.png/300px-%E7%9C%9F%C2%B7%E5%B7%AE%E5%88%86%E6%9C%BA.png,真·差分机.png,-,
亨利・杰基尔＆海德,81,175cm,60kg,化身博士,欧洲,ヘンリー・ジキル,Henry Jekyll,中原,宫野真守,Assassin,男性,秩序·善,地,C+,E,A+,E,C,C,天地从者、所爱之人,"19世纪的小说『化身博士』中，
登场的角色——或者说是该角色原型的人物。
他本想将自己人格中「邪恶」部分剥离，
结果却导致「邪恶」的人格显现出来，
最终犯下了杀人的恶行，走上了自我毁灭的道路。","身高／体重：175cm·60kg
出处：『化身博士』
地域：欧洲
属性：秩序·善（杰基尔）／混沌·恶（海德）
随着人格的切换，肉体也会发生变化的双重人格持有者。","【杰基尔】
诚实而理性的好人——本来的人格。
对万事都会深思熟虑，既是优点也是缺点。
与表面相反，正义感十足，
生前苦恼于「潜藏于人类内心的邪恶」，企图与之对抗。","【海德】
毫无道德心的快乐主义者——「邪恶」的人格。
下意识会伤害所有一切的，恶意的反英雄。
不知是杰基尔的内心潜藏着邪恶，
还是因杰基尔本身就缺乏邪心，
导致才「只有这个程度而已」，这点不明。","『隐秘的罪之游戏』
阶级：C、种类：对人宝具
Dangerous Game。让杰基尔变化为海德，
海德变化为杰基尔的灵药。化身为海德时，
拥有能媲美三骑士职阶的近身战斗力。","无力之壳：A
精神与肉体处于杰基尔的状态时能力值一落千丈，
也很难以从者的身份被探知。
反之，通过使用宝具成为海德时，
仿佛受到了反作用力，能力会急剧提升。",?,维系心之物,"决不能失去心。
决不能忘记仁慈、庇护、爱。

人会轻易堕落。坠入邪恶的快乐中。
否定企图伤害、嘲笑、贬低他人的自己吧。
因为这不过是软弱的表现罢了。
我每天都站在镜子前，这样告诫自己。
要保持正确。
哪怕世界中大部分事物已化为邪恶的掌中物。",https://fgo.wiki/images/thumb/f/f2/%E7%BB%B4%E7%B3%BB%E5%BF%83%E4%B9%8B%E7%89%A9.png/300px-%E7%BB%B4%E7%B3%BB%E5%BF%83%E4%B9%8B%E7%89%A9.png,维系心之物.png,-,
弗兰肯斯坦,82,172cm,48kg,创作,欧洲全域,フランケンシュタイン,Frankenstein,冈崎武士,野中蓝,Berserker,女性,混沌·中庸,地,C,B,D,D,B,C,天地从者,"维克多·弗兰肯斯坦创造的人工生命体。
作为与亚当成对的夏娃而被制造出来，
但由于无法流畅地表现喜怒哀乐等感情，
被判定为失败作品。","身高／体重：172cm·48kg
出处：创作
地域：欧洲全域
属性：混沌·中庸　　　性别：女性
若想节约用电的话就直接把PC的插头给拔了。","弗兰肯斯坦与小说中描写的形象差异相当大，
维克多原本打算创造亚当和夏娃——
也就是以起源创造为目的而制作的。
但与圣经相反，他先创造了夏娃，
打算让夏娃生下亚当。","然而，作为关键的夏娃——
通过缝合尸体制作的人工生命体是失败作品。
无法正常地控制和交流感情，
见到她毫不犹豫地杀害野狗，
并将内脏作为礼物赠送给自己的残暴本性，
维克多害怕地逃跑了。","然而，被丢弃的弗兰肯斯坦通过接触这个世界，
逐渐磨练自己的知性与感情，
终于萌生了对抛弃自己的维克多的愤怒。
面对执着地追赶自己到南极的她，
维克多精疲力竭，选择了自尽。","她之所以会寻求自己的对象，不是因为本能的欲望，
而是为了追求理性——即希望能如同普通人类般生存。
唯有成功令她敞开心扉，才有可能被她选为御主吧，
也就是「弗兰肯斯坦的新郎」。",?,成为人类的道路,"所有生物都是奇迹的产物。
因此，创造生命的行为是神圣的，
也无疑是代替神明之举。
倘若创造对象是复杂至极的人类，
或可称之为最极致的神圣行为吧。

接下来即将进行的，是蹂躏这一切的行为。
我将以科学、科学、以及些许的魔术，
为世界带来奇迹！

……然而愚者遗忘了一件事。
那就是这奇迹绝不是什么美妙的存在。",https://fgo.wiki/images/thumb/2/24/%E6%88%90%E4%B8%BA%E4%BA%BA%E7%B1%BB%E7%9A%84%E9%81%93%E8%B7%AF.png/300px-%E6%88%90%E4%B8%BA%E4%BA%BA%E7%B1%BB%E7%9A%84%E9%81%93%E8%B7%AF.png,成为人类的道路.png,-,
阿周那,84,177cm,72kg,摩诃婆罗多,印度,アルジュナ,Arjuna,pako,岛崎信长,Archer,男性,秩序·中庸,天,A,B,B,B,A++,EX,神性、天地从者,"印度古代叙事诗「摩诃婆罗多」的大英雄。
摩诃婆罗多是印度各英雄集结一堂的华丽绚烂的故事，
但若说阿周那是位于中心位置的人物，这一点也不为过。","身高／体重：177cm·72kg
出处：摩诃婆罗多
地域：印度
属性：秩序·中庸　　性别：男性
爱用的弓是『甘狄拔』。是火神阿耆尼赠与他的神弓。","若说迦尔纳是“施舍的英雄”，
那阿周那就是“天授的英雄”。
俱卢国王的儿子，他作为般度五子中的第三子，
同时也是雷神因陀罗的儿子。","作为一名才干、性格等各种方面都毫无瑕疵的英雄，
他却因在兄长在赌注中失败而被国家放逐。
这时，他已经预感到与迦尔纳的对决是不可避免的。
这都是因为迦尔纳将般度五子的宿敌——难敌尊敬如父。","爱着兄弟，也被兄弟所爱。
爱着父母，也被父母所爱。
爱着人民，也被人民所爱。
尽管如此——。","已然记不起何时下决心必须杀了迦尔纳。
或许是从最初见面的那刻起吧。
这不是诸神所注定的命运。
这是阿周那本着纯粹的敌意选择的业（Karma）。
哪怕这并不正确，阿周那也不得不去完成。",?,天赐的英雄,"——将财宝，赐予你。
——将力量，授予你。
——将所有一切，给与你。

当被给予了一切后，
才发现所有一切都浪费了。
在下，我想要的，
并不是这种东西。

所以现在，为了抓住真正想要的存在，
我要拼上自己的性命。
将所有人都珍惜疼爱的我那生命作为赌资，
随便地扔上了赌桌。

说实话吧。
这种行为太痛快了！",https://fgo.wiki/images/thumb/e/e9/%E5%A4%A9%E8%B5%90%E7%9A%84%E8%8B%B1%E9%9B%84.png/300px-%E5%A4%A9%E8%B5%90%E7%9A%84%E8%8B%B1%E9%9B%84.png,天赐的英雄.png,-,
迦尔纳,85,178cm,65kg,摩诃婆罗多,印度,カルナ,Karna,pako,游佐浩二,Lancer,男性,秩序·善,天,B,C,A,B,D,EX,神性、骑乘、天地从者、所爱之人,"印度古代叙事诗「摩诃婆罗多」的大英雄。
是身处摩诃婆罗多中心位置的英雄阿周那的对手，
也是他的异父兄弟。遭到众多诅咒，身体无法动弹的他，
最终以近乎谋杀的形式被阿周那杀害。","身高／体重：178cm·65kg
出处：摩诃婆罗多
地域：印度
属性：秩序·善　　性别：男性
也可作为Archer、Rider存在。","迦尔纳是人类女性贡蒂与太阳神苏利耶所生的半神英雄。
但他出生后，立刻遭到贡蒂的抛弃，
被作为车夫的儿子抚养。
可他作为英雄的资质绝不可能被埋没。","母亲贡蒂抛弃了迦尔纳之后，生下了般度王家的五兄弟。
其中第三子就是迦尔纳终生的宿敌阿周那。
长大后的迦尔纳成了与般度家对立的俱卢家的养子。","然而，就连迦尔纳与阿周那的战斗，
都遭到了众多诅咒的妨碍。受婆罗门诅咒，
被因陀罗欺骗，答应了母亲贡蒂的请求，
发誓不与阿周那以外的任何人战斗。
尽管如此，迦尔纳还是接受了一切。","在铠甲转让因陀罗的传说中，
迦尔纳分解、抛弃了黄金铠甲，
从而获得了弑神之枪。
连诸神之王都无法自由掌控的光之枪。
沾染全身剥离之血所释放的一击
能一扫所有不净之物。

——日轮啊，顺从死亡。",?,贫者一灯,"过去，觉者受王邀请，被盛情款待。
宴会持续到夜晚，觉者的归途被黑暗所笼罩。

王动用巨资，为道路安置明灯，
可区区一次强风就熄灭了王准备的所有灯火。

然而觉者之路却依然被微弱的灯光映照。
那是一位身份不足以出席宴会，
也无法准备礼物的贫穷老人留下的
满怀心意的一盏明灯。

——无数的称赞，无数的憧憬
虽然确实能将人生点缀得十分华美。
但谁人都未注意到的一颗真心，
便可令人感到自己的人生充满幸福。",https://fgo.wiki/images/thumb/d/dd/%E8%B4%AB%E8%80%85%E4%B8%80%E7%81%AF.png/300px-%E8%B4%AB%E8%80%85%E4%B8%80%E7%81%AF.png,贫者一灯.png,-,
谜之女主角X,86,154cm,42kg,2013年愚人节,从者界,謎のヒロインX,Mysterious Heroine X,BUNBUN,川澄绫子,Assassin,女性,混沌·善,星,B,C,A+,B,D,A++,骑乘、龙、阿尔托莉雅脸、亚瑟、王,"从被称为从者宇宙的神秘时空来访的异乡之人。
自称Saber职阶的决定版，
身为一名骑士，
光明正大地发动暗算的对Saber用决战兵器。

代号·A-X。","身高／体重：154cm·42kg
出处：2013年愚人节
地域：从者界
属性：混沌·善　　　性别：女性
用神秘魔剑『无铭胜利剑』把敌人都杀掉吧。","「阿尔托莉雅种族就像是宇宙的癌。
　必须有人去切除才行。
　必须有人去做。」

面露苦涩的表情，女主X背井离乡。
驾驶着爱机金色神驹Ⅱ号在星海驰骋。","其外形与一般从者截然不同，
身着休闲运动风的服装。
蓝色的围巾是勇气的标志，
帽子是为了隐藏其呆毛真身。
但戳出来了，戳出来了，彻底戳出来了。","作为对Saber决战兵器，
只知一味打倒所有Saber的她，
赌上这把圣剑，宁将此身化为修罗模式，
然而她唯独对Saber Lily敞开了心怀。","在来到这里之前，她曾拯救了古代王朝的危机，
解决了人类统一工会的内斗，
赶走了从其他宇宙到来的侵略者。
但这些事对她而言都是小菜一碟。
这都是些鸡毛蒜皮的事，所以她根本没记在心上。

为了达成悲愿，她将继续挥舞无铭胜利剑。
另外黄金大帝宇宙吉尔伽美斯是无论如何都要干掉的。",?,歼灭清单,"「一个Saber、两个Saber……Saber……
　啊啊，又增加了一个！」
深夜的迦勒底回响起阵阵毛骨悚然的声音。
据说每当Saber增加一个人，充满神秘从者怨念的诅咒声
就会响起什么的。
「真奇怪啊，我明明逐一对他们实行了半夜偷袭，但怎
　么还是在一味增加啊。」
真希望你能考虑一下每次发生这种事时都要召唤回复系
从者的御主有多辛苦。
「好吧，算了。那今天也为了实现梦想，重复唱一百次
　打倒Saber！」
Saber必须死Saber必须死Saber必须死Saber必须死
Saber必须死……只要听到这种用流行电音调唱的台词，
Saber就会遭遇鞋带断掉或是蝉撞到脸上这种不幸——
少女内心暗想，如果真的发生这种事就好了。",https://fgo.wiki/images/thumb/c/cc/%E6%AD%BC%E7%81%AD%E6%B8%85%E5%8D%95.png/300px-%E6%AD%BC%E7%81%AD%E6%B8%85%E5%8D%95.png,歼灭清单.png,-,
芬恩・麦克库尔,87,181cm,63kg,凯尔特神话,欧洲,フィン・マックール,Fionn mac Cumhaill,森山大辅,三木真一郎,Lancer,男性,中立·中庸,天,B+,B,A+,C,C,B+,神性、天地从者,"凯尔特战神努亚达的后裔，光荣的费奥纳骑士团团长。
他打倒了能操纵睡眠与火焰的邪恶神灵，拯救了都城，
身为爱林（爱尔兰）的守护者，打倒侵略者与魔物，
是位建立了无数功勋的大英雄。
钻研魔术与睿智，原本拥有诸多能力与宝具。","身高／体重：181cm·63kg
出处：凯尔特神话
地域：欧洲
属性：中立·中庸　　　性别：男性
身为Lancer职阶时，将枪与治愈的力量作为自己的宝具。","效忠于爱林的上王，在光荣的费奥纳骑士团中，
立下了足以被称颂为最伟大骑士以及骑士团之长的功勋。
衰败的神灵亚连，魔猪，冥界之马，
最终甚至连自己的神祖，也就是战神努亚达都被他击败了。
平时据说是一位喜爱和骑士团的部下们打打猎，
过着平静生活的大人物。","本应顺着无可非议的大英雄之路前进的他，
却注定拥有桃花劫的命运。迷上美丽的姊妹，
遭到诅咒是他遭遇的第一难。之后灾难便接连不断。
由于第一妻子，他与妖精们敌对，耗费了七年的时光，
而围绕第三妻子格兰妮引发的争斗，
则让辉煌的骑士团土崩瓦解。","问题难道并非出在女人们身上，而是出在自己身上──
直到最后，芬恩·麦克库尔都没有产生这种念头。
到底做错了什么。哪怕化为英灵，
作为从者现界的现在，他都没有弄明白。","『无败紫靫草』
阶级：A　　种类：对军宝具
Mac an Luin。
拥有自动攻击，精神干涉无效化等效果。真名解放之后，
可以释放出伴随着司掌着「流水」的战神努亚达之力的
激烈奔流的强烈一击。
真名源自其爱剑的剑铭。这把剑常常也被视作长枪，
作为宝具而成立之际，同化为杀死了神灵亚连的长枪。",?,智慧之鱼,"——御主。吃鲑鱼吧，会让脑袋变聪明的。

当然，不可能得到无限的睿智。
能做到这点的，唯有拥有闪耀彩虹色鳞片的鲑鱼。
但是，鲑鱼脂肪内含有大量能提高集中力的物质，
所以肯定不会完全没有效果。

不能只有强大，只有美丽。
你应该变得更聪明。
应该拥有当遇到什么障碍，遭遇失败的时候……
能够回顾总结自身的聪明才智。

唔？
你说——如果有智慧很聪明的话，
只要保证自己做的事不失败就行了？
呵呵，确实，这是理想的情况！

但是人总是会犯错的。
人无法保证自己总能选择正确的道路。

所以，来。你也吃点鲑鱼吧。",https://fgo.wiki/images/thumb/8/83/%E6%99%BA%E6%85%A7%E4%B9%8B%E9%B1%BC.png/300px-%E6%99%BA%E6%85%A7%E4%B9%8B%E9%B1%BC.png,智慧之鱼.png,-,
布伦希尔德,88,172cm,52kg,北欧神话,欧洲,ブリュンヒルデ,Brynhild,三轮士郎,能登麻美子,Lancer,女性,中立·善,天,B+,A,A,C,E,A,神性、骑乘、天地从者,"北欧主神奥丁的女儿，女武神瓦尔基里中的一人。
北欧神话中的悲剧之女。
是被视作与『沃尔松格传』中的大英雄——
齐格鲁德的命运爱人希格德莉法为同一存在的女武神。
在老埃达的『希格德莉法之歌』，
以及『布伦希尔德的冥府之旅』中，
同样被描述为与齐格鲁德坠入爱河的女武神。","身高／体重：172cm·52kg
出处：北欧神话
地域：欧洲
属性：中立·善　　　性别：女性
在『沃尔松格传』，老埃达的『古德伦之诗』，
以及『齐格鲁德短歌』等作品中，
被描述为阿提拉王（阿特利王）的妹妹。","性格文静舍己。
稳重的微笑中带着一丝寂寥，不幸的女武神。
作为女武神中长姐尚为神灵之身时，
虽然行为仿佛「人偶」般缺乏自我意识，
但在惹怒了父神奥丁，
被贬入人间之后，由于与齐格鲁德的邂逅，
逐渐开始拥有人类的性质与人格。","心怀慈悲，爱情情感丰富，会对自己所爱之人付出一切。
若未发生那种悲剧，她本应作为一名贤妻终其一生。
尽管比谁都更为深爱着英雄齐格鲁德，
却在被诅咒的悲剧命运下，心中燃起了杀意之火，
最终不仅杀死了齐格鲁德，也将自己灼烧殆尽。","『直至死亡拆散两人』
阶级：B　种类：对人宝具
Brynhild Romantia。
将对宿命对象心怀的深刻爱憎之情
化为她生前所使用的魔银之枪形态的宝具。
对于对方的爱情越是强烈，
枪就会变得越为沉重而巨大。
对于深爱着的齐格鲁德则能发挥出极为鲜明的效果。
（对于与齐格鲁德颇有因缘的齐格飞也同样效果卓越）","即使是已成为英灵的现在，她依然深爱着齐格鲁德。
然而，如果万一他真的在自己眼前应召唤而来的话，
她应该会自动将枪头对准他吧。
这是由于作为英灵的她自身以及其宝具
已经一同被定义为「杀死齐格鲁德之物」的缘故。",?,永不消失的火焰,"——我，在燃烧。

嗯。在燃烧。
嗯。是火焰。
不，这不是什么玩笑。是真的。
哪怕正在和你对话的现在，我也在燃烧。
难道你听不到火焰熊熊燃烧的声音吗？

我这个体的开始到终结都与火焰同在。
见到齐格鲁德时，杀害齐格鲁德时。
我的意识诞生之时，我的生命终结之时。
我始终被火焰所缠绕。

等意识到时，我已经成为了火焰本身。
你应该能看到吧？
青色的火焰。
魔力放出？
不，不。
这是从我心灵溢出的我感情的形态。
就算死去，哪怕死去，也绝不会消失。

如果看上去消失了——
呵呵。不，还是不会消失。
一定只是被火熏得看不见了而已。",https://fgo.wiki/images/thumb/2/26/%E6%B0%B8%E4%B8%8D%E6%B6%88%E5%A4%B1%E7%9A%84%E7%81%AB%E7%84%B0.png/300px-%E6%B0%B8%E4%B8%8D%E6%B6%88%E5%A4%B1%E7%9A%84%E7%81%AB%E7%84%B0.png,永不消失的火焰.png,-,
贝奥武夫,89,186cm,81kg,贝奥武夫,北欧,ベオウルフ,Beowulf,下越,中井和哉,Berserker,男性,混沌·善,地,A,A,C,D,A,A,天地从者、所爱之人、王,"贝奥武夫是公认为英语文学中最古老的叙事诗——
『贝奥武夫』的主人公。
这部叙事诗的舞台位于现今瑞典南部至丹麦附近。","身高／体重：186cm·81kg
出处：贝奥武夫
地域：北欧
属性：混沌·善　　　性别：男性
因狂化所带来的正负面效果都几乎已消失殆尽，
所以可以通过对话与之进行沟通。","狂化：E-
这名英雄的真名本身即受到Berserker这一名词的影响。
保有理性，能够进行高等的对话。
多少仍残留着些许凶暴性，但对于能力没有任何影响。","整个故事由两部分构成，第一部记述了，
贝奥武夫与15名部下共同前往讨伐巨人哥伦多的事迹，
第二部中则详细描述了50年后，
年迈的贝奥武夫与巨龙死斗的传说。","传说与年迈的贝奥武夫对抗的巨龙喜好囤积财宝，
能够口喷火焰——
或许可以说这就是后世奇幻作品中巨龙的原型吧。
虽然他平时所用的两把长剑被称为魔剑，
但这并非贝奥武夫真正的力量。","作为从者职阶之一的Berserker的语源
来自于北欧神话中的Berserk，
同时传说贝奥武夫之名也同样来自于Berserk一词。
然而，在垂老之年仍保持着理性
完成屠龙伟业的贝奥武夫没有表现出丝毫狂暴之意。",?,最后之战,"——部下们四散逃跑，
留下的只有瘦弱衰老的自己，
和颤抖着却坚持留下的一名年轻骑士。

靠这面大盾，是否能够防御龙的吐息呢。
就算能够防御，又该如何打倒龙呢。
弱点在何处，想要刺中弱点需要坚持度过多少困难才行。
时间过得如此之慢。但却有充分的思考时间。
我为什么在战斗。为什么想要战斗。
年轻时代的热情早已消逝，剩下的只有对安稳的渴望。
「……不，原来如此。」
本已消逝的斗志再次点燃。
这里乃求死之处，是适合自己终结的地狱。

人已衰老，已没有了击破哥伦多的热情。
然而，自己的背后却有安稳。
无数人享受着简朴的幸福，
努力维持着没有严苛与绝望的生活。

「偶尔也要做点像个王的事才行呢。」

不为自己，不为名誉，不为富贵。
只是身为王，完成自己的义务。
觉醒吧——贝奥武夫。
虽然你的力量和全盛期相比相差甚远。
但绝不是毫无力量的。",https://fgo.wiki/images/thumb/e/e5/%E6%9C%80%E5%90%8E%E4%B9%8B%E6%88%98.png/300px-%E6%9C%80%E5%90%8E%E4%B9%8B%E6%88%98.png,最后之战.png,-,
