埃列什基伽勒,196,159cm,47kg,古代美索不达米亚神话,美索不达米亚,エレシュキガル,Ereshkigal,MORII SHIZUKI,植田佳奈,Lancer,女性,混沌·恶,地,A,B,D,B,B,A,神性、天地从者(拟似从者)、王,"苏美尔神话中的冥界之神。
能自由操控外形似枪的牢笼，时而穿刺敌人、
时而囚禁灵魂、时而降下闪电的可怕冥界支配者。
自诞生以来就担任管理冥界的职务，
不知地表与自由为何，就随神代一起消失的女神。
其外表并不是属于埃列什基伽勒女神的，
而是处于将灵魂附身在与她波长相近的人类身上的
拟似从者状态。
尽管非常有冥界女神风范地称监视人类是自己的职责，
但依然会说什么「……很多人一股脑涌进冥界只会给我
添麻烦啊……制作囚禁灵魂的牢狱是很辛苦的……
不知道我是否能为他们提供舒适的居所呢……」，
难以掩盖自己很会照顾人的一面。
简直就是冥界的（红色）天使。","身高／体重：159cm·47kg
出处：古代美索不达米亚神话
地域：美索不达米亚
属性：混沌·恶　　　性别：女性
「我对区区人类没什么兴趣。活着的东西非常恶心。
  不过，如果你坚持的话，我还是愿意以死亡为前提
  陪你的哦？」","在美索不达米亚神话原典中，
司掌植物的成长与腐败，使役蛇与龙，
能自如操控冥界使者迦鲁拉灵。
身为『天之女主人』的伊什塔尔
与身为『冥界女主人』的埃列什基伽勒是对手关系。
从神话学来看，丰收的女神伊什塔尔（伊南娜）是
代表了人类之生的大地母神，
而代表了人类之死的埃列什基伽勒则是恐惧母神。

神话中的伊什塔尔前往冥界，并为埃列什基伽勒所杀。
之后伊什塔尔虽然得以复活，但她为何要前去冥界，
而埃列什基伽勒为何如此震怒，其中理由一概没被提及，在本作中认为这是基于两人表里一体的关系所致。
伊什塔尔与埃列什基伽勒。或许这两位神是同一存在，
又或是由一位神一分为二的神性。","『灵峰踏抱冥府之鞴』
阶级：A　种类：对山宝具
有效范围：10～999　最大捕捉：1000人
Kur Kigal Irkalla

与伊什塔尔的宝具山脉震撼明星之薪是相同的存在。
只不过这宝具并不是从天空向大地投掷，而是由地底
顺着绵延不断的大地发动的冥界女主人之铁锤。
通过地震、地壳变动来令艾比夫山崩溃的大地震动。
威力虽然比不过伊什塔尔的金星爆破，
但这宝具的神髓在于『将地形化为冥界』。
只要身在冥界就能拥有极大权力的埃列什基伽勒
会赐予所有与她并肩作战之人强大的守护。","对魔力：D
能令D级以下的魔术无效化。
由于被冥界的阴气所浸透，死亡成了极为日常的存在，
因此对魔力显著下降。

隐藏的大王冠：A
使用从伊什塔尔那里没收来的宝物制作而成的女神之冠。
身为天与地、表里一体的女神，
将伊什塔尔拥有的各种权能化为自己的东西，
其效果变得有些阴暗（阴沉）。

魔力放出（槛）：A+
埃列什基伽勒是个勤恳认真，却又有些消极的女神。
她平时只要一有空，就会将魔力积蓄在枪槛中，
并在战斗时使用。

冥界佑护：EX
作为冥界的支柱被献上，
并统治冥界的埃列什基伽勒的权能。
会统治冥界到终结时刻的她就是冥界本身，
同时，也成了被冥界守护的女王。
能对己方全体进行支援，也能让她的宝具性能产生变化。","性格被动、内向。
由于拥有极高的知性与自尊心，
为冥界主人这份职责鞠躬尽瘁，
以至于行动遭束缚的死与腐败的女神。
嫉妒美丽的存在，嘲笑丑陋的存在，
为了不让自己想要的东西落入他人之手而杀害对方。
……埃列什基伽勒本是这样一个存在，
但通过与躯壳的少女融合，她开始客观地认识到
这种欲望是「不好的」、「令人害臊的」，
凶暴的性质从而消失在了深层之下。
然而她性格直率，所以一旦生气就会表现出来，
成为如神话传说中般可怕且美中不足的女神。
其行动理念是埃列什基伽勒自己的，
所以比躯壳的少女更为冷静，也显得更为自虐。

会与伊什塔尔说相同的台词，
但时不时会使用高贵大小姐的口气。
直率，或是陷入恐慌的时候，语气会显得有些夸张，
但这也是循规蹈矩的她『真实一面』的体现。
被当做千金小姐抚养长大的伊什塔尔
由于其任性与自由奔放的个性，语气十分活泼，
反倒是在冥界认真工作的埃列什基伽勒
会用『千金（不谙世事）大小姐』的措辞。","从神话时代开始，埃列什基伽勒就因自己遭人厌恶，
生活在阴暗处而感到痛苦、憎恨。
她甚至拥有「我也想像伊什塔尔那样自由地生活。
我想遇见一个明知我是冥界主人，
也能不在乎冥界主人地位，并与我相处的人」
这种极为少女的愿望。
正当她内心纠结于
「我不否定反派，明明恶也会以恶的方式帮助人类，
  为什么大家都那么害怕呢！」的时候，
得知了美索不达米亚世界即将迎来的终焉，
她为了以自己的方式守护人类，
才加入了三女神同盟，成了乌鲁克的敌人。

那之后发生了不少事，她也沉入了深渊，
但她也由于一些事肯定“现在的自己”，
选择帮助迦勒底修复人理之路。

她手持的枪乃是发热神殿美斯拉姆忒亚。
是只有拥有这个灵基时才被允许拥有的，
存在于地底的温暖之光。",花开冥界,"即便如此，最终，
命运与职责也没发生什么很大的改变。

你依然是你，
她依然是她，
彼此居住的场所并不遥远，同时，
彼此的尊严也不会受到损害。
但是，正因为如此，才能为这份灿烂而笑。
尽管只是些许小事，尽管只是瞬间回忆，
但仍犹如小刺，令胸口隐隐作痛。

即便冥界不会长出葡萄树藤，
你也是我的葡萄果实。
是那无论经历多少星霜岁月，
依然会令内心焦急的星星。
哪怕在我消失之后，
唯有这份热量是不会消失的吧。

神代已然终结，灵魂也不会再留存于这片土地上了，
孤独留到最后的主人完成了自己的使命后。
明亮的阳光必然会映照这荒野。
这是梦中无数次见到的光辉记忆的残照。
——花开冥界。
我会像这样，心中怀着幸福的感情，
化作花朵消失不见。",https://fgo.wiki/images/thumb/f/f6/%E8%8A%B1%E5%BC%80%E5%86%A5%E7%95%8C.png/300px-%E8%8A%B1%E5%BC%80%E5%86%A5%E7%95%8C.png,花开冥界.png,-,
阿蒂拉·the·San(ta),197,160cm,48kg,冥界的圣诞快乐,芬兰,アルテラ,Altera,huke,能登麻美子,Archer,女性,混沌·善,星,C,B,A+,A,A,EX,神性、骑乘、王,"仰望天空吧。
向平安夜许愿之人一定能看到。
看到驰骋过夜空的彩虹，咩咩叫的羊群，
以及身着大胆服饰，
似乎有点感冒倾向的美丽圣诞老人的身影……！

其名为阿蒂拉·the·San〔ta〕。
西方大王，拥有星之纹章的剑姬从多舛的命运中
觉醒了身为圣诞老人的使命，克服了起初的身体不适（低烧），毅然挺身而出的令人倍感可靠的第三位圣诞英灵。

这次在大王轶事中多次登场的游牧骑兵也随侍左右。
……然而，它们都长着可爱绵羊（只不过是宇宙规格）的
样子。这究竟是为什么呢。","身高／体重：160cm·48kg
出处：冥界的圣诞快乐
地域：芬兰（自称）
属性：混沌·善　　　性别：女性
骑乘的羊名为茨尔戈。
擅长模仿圣诞老人长老。
※圣诞老人长老是阿蒂拉想象的生物。","拥有过度健康的肉体与过度健全的精神，
以及些许无知……
不，是无暇性格的她得到了一个千载难逢的机会。
当迦勒底的工作人员们因为谜之热病倒下之时，
阿蒂拉·the·San〔ta〕作为唯一『能动的从者』，
为了迦勒底的和平与圣诞节，骑着名羊茨尔戈飞驰而出。

对于早就想要评估圣诞节这种文明的阿蒂拉来说，
这乃是求之不得的工作。
换上华美的圣诞服饰，她潜入冥界的天空。
唯一令人不安的要素就是圣诞老人服饰不够保暖，
「和平时的衣服相比，面积是不是太少了……？」
阿蒂拉不禁歪着头感到疑惑。","性格基本还是阿蒂拉的，因为有些低烧，
所以判断力不如平时，也很容易糊弄过去。
外表看上去惹人怜爱、可爱程度似乎有所提升。
由于（多亏了）发烧，文明破坏属性显著低下。

平时的阿蒂拉身为战士的人格占9成，
身为少女的人格占1成，
而圣诞老人阿蒂拉身为战士的人格占4成，
身为少女的人格占了6成。
阿蒂拉本质还是有少女的性质和浪漫主义色彩的，
所以能担任圣诞老人的工作让她非常高兴＆激动不已。

或许因为她将御主视为可靠的搭档兼美丽的羊，
所以称御主为「软绵绵的御主」。
由于她说服自己，现在的自己不仅是阿蒂拉，
更是圣诞老人，所以在对人处事上比平时更为柔和。
为了将闪耀的羊托付给自己的『重要礼物』送达目的地，
她很直率地请求御主帮助。","对魔力：C
由于其天生的温柔，
在受到『这不是我想要的礼物』这种投诉时无法反驳，
导致魔力抗性比身为Saber时明显低下。

骑乘：EX
被选为圣诞节的英灵，内心平静地燃起了使命感之火的
阿蒂拉的骑乘技能大幅提升、变化。
具体来说，就是成了羊大师。
她骑乘着非名马的名羊茨尔戈疾驰的样子，
令人不禁联想起过去驰骋于西方世界的
游牧骑马民族·匈族最强的王……
联想……能联想到吗……

文明侵蚀：EX
英灵阿蒂拉本人毫无自觉地发动的技能。
能将手持的东西变化成对现在自己而言最好的属性。
『最好』并不是『优秀』的意思，
而是指阿蒂拉本人最喜欢的东西。
这次阿蒂拉最喜欢的东西应该不言而喻了吧。
原本麾下率领的马匹都变化成了羊（之类的东西），
而爱剑军神之剑则变形成了拐杖糖（杖）。","星者的礼物：B
通过化身为圣诞老人从而获得的技能。
赠送礼物，滋润心灵。
尽管阿蒂拉很想赠送他人礼物，但总是无法掌握对方的
愿望，再加上她内向的性格，技能等级比圣诞Alter
（阿尔托莉雅）较低，而且不知为何，
技能名也发生了些许变化。

虹之糖艺：B
圣诞树顶装饰的星星被称为伯利恒之星，
据称其象征着救世主。
据说只要用阿蒂拉的杖砰地敲打一下，
就会赐予该人极大的祝福与恩惠。

耀星之纹章：EX
刻印在阿蒂拉身体上的独特纹样与圣诞节的概念
融合变化而成的技能。
通过这种强大的祝福力量，能令刻印在阿蒂拉灵基上的
潜力觉醒，让圣诞阿蒂拉能在地球上行动3分钟！
只能持续3回合的舍身超强化。

天性的肉体：－
由于成为圣诞节英灵，被付与了冬天的概念，
以至于体温无法正常调整，遗憾地失去了这个能力。",?,驰骋于夜空之虹,"纷飞雪花之中，圣诞老人与羊驰骋而过。
一条彩虹划过多重轨迹，
映照着黑暗的天空。
这并非灾祸的行星，
犹如实现愿望的彗星。
诞生于地上的流浪公主
为只有一夜的职责兴奋不已。
尽管脑袋有些发烧，
但她依然是她，由衷露出了微笑。

「……嗯，礼物是好文明。
　因为无论是焦急等待之人，还是递送礼物之人，
　都在祈祷着相互的幸福。
　胆敢妨碍这闪耀夜晚的坏家伙
　一定会遭到软绵绵御主降下的天罚。
　具体来说，就是我的神之鞭。
　嚯～嚯～嚯～。我可是圣诞老人哦？」",https://fgo.wiki/images/thumb/0/02/%E9%A9%B0%E9%AA%8B%E4%BA%8E%E5%A4%9C%E7%A9%BA%E4%B9%8B%E8%99%B9.png/300px-%E9%A9%B0%E9%AA%8B%E4%BA%8E%E5%A4%9C%E7%A9%BA%E4%B9%8B%E8%99%B9.png,驰骋于夜空之虹.png,-,
葛饰北斋,198,162cm,51kg,史实,日本,葛飾北斎,Katsushika Hokusai,黑星红白,Yukana,Foreigner,女性,混沌·中庸,人,D,D,B,B,A,A,神性、人类威胁,"你说我看上去实在不像北斋？
很抱歉我长得那么娇小可爱，如果你想了解个中缘由，
就来加入我的故事吧！","身高／体重：162cm·51kg
出处：史实
地域：日本
属性：混沌·中庸　　性别：女性
总是与奇妙章鱼“爹爹”在一起。","江户时代后期的浮世绘画师。
除了「葛饰北斋」以外，
还拥有「画狂老人」、「宗理」等30多个雅号。
是日本的代表性画家，对梵高与德彪西等海外画家、
音乐家也产生了深远的影响。
以绘画速度超群而著称，其一生留下了3万件作品。
内容覆盖了浮世绘的版画、肉笔画、漫画、
春画等多种类型。
晚年以三女儿“葛饰应为”为助手，并与她一起生活。
代表作是连作『富岳三十六景』、『北斋漫画』、
妖怪绘『百物语』、春画『蛸与海女』等。
一生一共搬家了93次，丝毫不在意钱财，
以至于一贫如洗，举止怪异引人注目，
是个出了名的怪人。
据说外出时口中常常念着咒语。","『富岳三十六景』
阶级：A　种类：对军宝具
Fugaku Sanjurokukei

众人皆知的Mr.北斋大作之伟大波浪（Great Wave）。
乃是连作浮世绘第二十一作『神奈川冲浪里』。
钻研自然的表现，宛若处于神灵附体般境地中
挥洒而出的笔锋具备了神秘的实体，
为鉴赏者的身心带去冲击。
通过与深渊邪神进行通信，得以觉醒了的北斋
陷入了疯狂，画出了独一无二的浮世绘。
那就是『神奈川异海里兴怀』。
“表富士”三十六景加上“里富士”十景，
以及向更深境地踏足的禁忌之笔。","森罗万象：A+
究明自然的样貌，看透其真髓的观察力。

父女的羁绊：A
直到晚年仍陪伴左右的北斋与应为的心灵羁绊，
是连邪神的疯狂都无法动摇的。

雅号·异星蛸：B
通过与深渊邪神达到浑然一体的境地，
从而绘出的非欧几里德几何学的画风。","性格与众不同的北斋。不局限于一种流派，
热心学习各种画师技法的同时，也充满了进取心。
吸收了西洋画的透视，将可以说是现代漫画原点的
截取动态瞬间的表现运用在风景画之中。
如果北斋显现于这个现代，脱离幕府严格的监管，
获得自由的话，一定会欣喜若狂地学习各种技巧，
并充满干劲地发起挑战吧。
无论对象是春画、抽象画、还是数码画或行为艺术。",?,富士越龙图,"“倘若上天再给我
　五年的寿命
　我才能获得真正的画工”
　　　　　　　　　～葛饰北斋临终之言～

『富士越龙图』几乎可以算是嘉永2年（公元1849年）
去世的北斋的绝笔画。享年90岁。
以年过70的高龄完成了连作『富岳三十六景』的北斋，
之后仍热情地不断绘画。甚至说出了仿佛此前画的作品
都不值一提似的话语。在73岁时多少悟到了一些
鸟兽虫鱼的骨骼与草木为何，80岁得以提升，
90岁参透了奥义，百岁才能真正超越神妙之域。
而到一百几十岁的时候，
才能令一笔一格变得栩栩如生吧——
飞越富士，升入天空之龙的图样
被人们视为包含了出人头地的意义，
但从中也能看到北斋永不厌倦的执着，
能感受到其哪怕知道自己寿命将尽却毫不在意，
并仍向着谁都未能达到的高度继续进发的，
北斋的意志吧。",https://fgo.wiki/images/thumb/5/5c/%E5%AF%8C%E5%A3%AB%E8%B6%8A%E9%BE%99%E5%9B%BE.png/300px-%E5%AF%8C%E5%A3%AB%E8%B6%8A%E9%BE%99%E5%9B%BE.png,富士越龙图.png,-,
塞弥拉弥斯,199,169cm,51kg,传承,中东,セミラミス,Semiramis,近卫乙嗣,真堂圭,Assassin,女性,秩序·恶,地,E,D,D,A,A,B,神性、天地从者、王,"世界最古老的毒杀者，也是亚述帝国的女帝。
由于毒杀了丈夫尼诺斯王而一跃成名。

另外，曾经有一段时间盛传世界七大奇迹之一的
『巴比伦空中花园』也是她建设的。
（实际建设者为尼布甲尼撒二世）","身高／体重：169cm·51kg
出处：传承
地域：中东
属性：秩序·恶　　性别：女性
脸上带着嫣然笑容的绝世美女。","女神得耳刻托与人类间诞下的塞弥拉弥斯，
因女神得耳刻托感到羞耻，结果被扔在了水边。
然而，身为继承了神之血脉的婴儿，
她在无数鸽子的抚养下，活了下来。

长大后出落得亭亭玉立的塞弥拉弥斯，
嫁给了年老的将军翁涅斯，
但被她美貌吸引的野心家尼诺斯王，几乎强行
将她从丈夫那里抢走。因此感到无比悲伤的翁涅斯自尽，塞弥拉弥斯无奈获得了尼诺斯王的宠爱。
当与别国发生战争的时候，
由于使用了塞弥拉弥斯建议的独特战法，
国家获得了胜利，尼诺斯王得知了她拥有卓越的才能，
终于决定与她正式结婚。
然而，在婚礼宴席上，喝下杯中之酒的尼诺斯王
突然痛苦地死去了。人们纷纷传说，
这是她为死去的丈夫复仇而下的毒。
于是，成了亚述女帝的塞弥拉弥斯，
在数十年统治期间，作为摄政执行政务，
并指导进行了多次远征与建设事业。

有传说最后她被儿子谋杀了，
也有传说她在让位之后，化为鸽子向远处飞去。","『虚荣的空中庭园』
阶级：EX　种类：对界宝具　
有效范围：10～100　最大捕捉：1000人　
Hanging Gardens of Babylon
巴比伦的空中花园。
实际上，塞弥拉弥斯与巴比伦的空中花园并没有关系。
只是利用了众多误会之人的信仰，作为宝具成立而已。

由于归根结底还是「虚荣」，
所以宝具的发动条件极为严格。
只有从存在于中东某年代以后的遗迹处，
运来一定量的土石并搭建起来，才能做好发动准备。
其后，通过举行为期三天的仪式，
作为庭园的机能才能发动。

如字面意思，是作为「浮游于空中的巨大要塞」显现。
只要身在要塞内部，
塞弥拉弥斯的能力就会全部提升一个阶级。
知名度也会提升到最高阶级，
在攻击时追加更为有利的修正。

在某次圣杯战争中，这座庭园成了决战场地。
十一防卫术式一一击坠了陆续杀来的飞机，
但最终被圣女之旗与飞行骑兵的突击突破了防御。","气息遮断：C+
隐蔽身为从者的气息，适合隐秘行动中使用。
只要转为攻击态势，气息遮断的阶级就会大幅下降。
但隐藏毒时，并不适用于这种情况。

阵地建造：EX
身为魔术师，建造对自己有利的阵地。
通过搜集具体的材料，
甚至可形成超越“神殿”的“空中庭园”。

二重召唤：B
Assassin 与 Caster，在获得双方职阶不同技能的情况下现界。是只有极少一部分从者才会拥有的稀少特性。","性格——狡猾，充满野心的女帝。无论是敌还是友，
都一律踢倒，下毒杀害，或是用毒让对方精神崩溃。
对他人的猜忌心十分强烈，即便是己方，只要有必要，
甚至哪怕没有必要，也会下手杀害。与此同时，
也对自己的力量怀有绝对自信（仅限自身的领域内）。
所以，她与其他的王极难相容，
不过与此同时也几乎不会自己主动发难。

例外是当『虚荣的空中庭园』以完全形态成立之时，
由于在其内部能拥有无与伦比的强大，
所以就会积极果敢地发动进攻。",?,不明之杯,"你与我缔结了强韧的羁绊。这是件好事。
因此我会信任你，并全力战斗。

但是，只是但是。
信任有时也会化作枷锁。
怀疑会成为禁忌，成为痛苦。

怀疑是一种好行为。
对那种愤怒地表示为何不相信自己的人，务必要小心。
因为那些人迟早会摆出「不希望被怀疑」的道理来。
所以平时就要保持观察，不停观察，不停观察。
无论欺骗人的行为能持续多久，
欺骗这一行为本身总是不自然的。
所以，这种不自然一定会表露出来。

铺垫说得太多了吧……
好了，我发誓这杯中没有放毒。

——我的话究竟是不是真的呢？",https://fgo.wiki/images/thumb/7/72/%E4%B8%8D%E6%98%8E%E4%B9%8B%E6%9D%AF.png/300px-%E4%B8%8D%E6%98%8E%E4%B9%8B%E6%9D%AF.png,不明之杯.png,-,
浅上藤乃,200,157cm,51kg,空之境界,日本,浅上藤乃,Asagami Fujino,武内崇,能登麻美子,Archer,女性,秩序·恶,人,E,B,D,A,C,EX,?,"在变异特异点·境界式发现的少女。

刻板为特色的女校制服、谦虚有礼的措辞、果断的行动力。这一切明明极为普通，却能感受到些许立场错位的不安定感。是能够无视硬度、构造、规模，扭曲所有映射于视野中存在的“歪曲之魔眼”的持有者。
浅上这个姓氏古代写作浅神，据说是能与神（异能）沟通的巫女家系。","身高／体重：157cm·51kg
出处：空之境界
地域：日本
属性：秩序·恶　　性别：女性
是个会令人联想到日本人偶的美人。举止略显阴沉，但依然透露着一股清秀感。","无痛症——五感中触觉麻痹，生来不知痛觉为何的少女。
由于不知疼痛，无法对他人感同身受，因此受到人们的孤立。
自幼就极为聪慧的藤乃为保护自己，隐瞒了自己无痛症的事实，向周围表现出“自己是个普通人类”的样子，同时也欺瞒了自己的内心。
联动活动『复刻版:空之境界/the Garden of Order -Revival-』的追加从者。在剧情中不会登场。作为客座嘉宾特别参战。","歪曲之魔眼：EX
在被称为魔眼的异能中也属于最上级的存在。
异能中的异能，稀少品中的稀少品。
无论无机还是有机，所有“作为物质存在的东西”都可被视为一张打印图像，通过扭曲图像，来无视对方的强度、规模进行扭曲与切断。

痛觉残留：A
分明已治愈，却依然反复的死之痛楚。人类的证明。浅神一族为封印少女的异能，将其触觉封了起来。

单独行动：A+
并非喜欢孤独，但有下意识独自乱晃的坏习惯。擅长跟踪之类的。魔力耗尽的本人理应非常痛苦，但因为痛觉很迟钝，以至于完全没发现。","『唯识·歪曲之魔眼』
阶级：EX　种类：对界宝具　有效范围：1～9999
Yuishiki Waikyoku no Magan
于夏日降临的怀念之物。
通过与千里眼（Clairvoyance）并发，从而脱离人类视野的视野——
把从神之俯瞰视角进行“确认”对象进行扭曲的超远距离物理崩溃。

被封锁的痛苦决堤而出画着螺旋。
——这种崩溃犹如痛哭的女人。","不到二十岁的少女。性格温和内向。
是贤妻良母型谦和的女性形象。
尽管不喜欢男性暴力的一面，但同时认为这种孩子气非常可爱。
因此，对完全理性的人怀有一种异于爱情的憧憬（恋慕的情感）。

是个注重常识，尊重对手的才女，但本质却是个彻头彻尾的悲观主义者与现实主义者，所以有时也会说出毫不留情的意见。忍耐力很强，可一旦失去控制，在将对手逼入绝路前（事态解决为止）决不会收手，犹如失控的货运卡车。
在这方面，和判断不留情面的式很相似。

行为、语气、性格都很女性化，但爱好却和少女相去甚远。喜欢观看恐怖电影等可以独自偷偷享受的阴暗的东西。
本人到最后都没有意识到，但她具备潜在的嗜虐性质。之所以一旦被逼入绝境，就会变得残酷、冷酷、恶趣味就是因为这个原因。","藤乃所在的时代由于人理烧却化为了灰烬。
她也同样被烧尽了，但世界的抑止力却没有放过她的特异性。
阿赖耶识采用她的异能作为颠覆人理烧却的战力之一，她才会作为暂定从者被召唤到了迦勒底。
对她来说，现在的自己不过是个『梦』。
和式一样，见证了燃尽前的景象，倘若无法颠覆人理烧却，就会消失的一夜幻梦。
一般的感性下或许早就混乱，并陷入恐慌了，但藤乃淡然地接受了这样的异常。
她明确理解作为从者被召唤而来的自己的立场，并在自己力所能及范围内努力帮助御主。",夏雨,"年幼时，曾见过温暖的光。

淡墨色天空。
滴落面颊的柔和水滴。
哪怕遭所有人拒绝，不被任何人所爱，
也仿佛听到可以留在『此处』的声音。

自那之后，时间流逝，铸成罪孽，
累积了诸多惩罚。
赎罪的日子遥遥无期，只要还活着，
哪怕心灵无法得到救赎，
她也会选择活在这个世界中。

——犹如跨越漫漫长夜。

由寂静中迈出步伐。
为了被那怀念的夏雨击打。",https://fgo.wiki/images/thumb/c/c3/%E5%A4%8F%E9%9B%A8.png/300px-%E5%A4%8F%E9%9B%A8.png,夏雨.png,-,
